{
  "avatar_description": "A man with a bald head and a full, reddish-brown beard is presented from the chest up, wearing professional business attire. He is smiling warmly at the viewer against a dark blue background featuring an abstract glowing network pattern, suggesting a tech-oriented or connected theme. The overall presentation conveys a sense of professionalism combined with an approachable and friendly demeanor.",
  "structured_description": {
    "description": "A man with a bald head and a full, reddish-brown beard is presented from the chest up, wearing professional business attire. He is smiling warmly at the viewer against a dark blue background featuring an abstract glowing network pattern, suggesting a tech-oriented or connected theme. The overall presentation conveys a sense of professionalism combined with an approachable and friendly demeanor.",
    "facial_features": "Bald head, full reddish-brown beard, dark eyebrows, and visible ears.",
    "expression": "A warm, open-mouthed smile with visible white teeth.",
    "attire": "Black suit jacket, white collared shirt, and a light blue tie with subtle horizontal stripes.",
    "palette": "Dominant dark blue, black, white, light blue, and warm skin tones with a reddish-brown beard.",
    "background": "Dark blue background featuring a glowing, interconnected network or constellation pattern with bright nodes.",
    "mood": "Professional and approachable"
  },
  "prompts": {
    "1x1": "Portrait prompt: primary hero shot. Subject description: A man with a bald head and a full, reddish-brown beard is presented from the chest up, wearing professional business attire. He is smiling warmly at the viewer against a dark blue background featuring an abstract glowing network pattern, suggesting a tech-oriented or connected theme. The overall presentation conveys a sense of professionalism combined with an approachable and friendly demeanor. Key visual traits: facial features: Bald head, full reddish-brown beard, dark eyebrows, and visible ears.; expression: A warm, open-mouthed smile with visible white teeth.; attire: Black suit jacket, white collared shirt, and a light blue tie with subtle horizontal stripes.; palette: Dominant dark blue, black, white, light blue, and warm skin tones with a reddish-brown beard.; background: Dark blue background featuring a glowing, interconnected network or constellation pattern with bright nodes.; mood: Professional and approachable. Profile traits (no text/logos): languages: Ruby, Shell, Python; repos: linux-for-pirates, loftwahs-cheatsheet; orgs: caremonkey, EddieHubCommunity. Visual guidance: Use the avatar as inspiration only; do not copy it verbatim. If the avatar is not a human photo, avoid rendering a realistic human faceâ€”use emblematic or stylized representation instead. Visual style: neon-lit anime portrait with confident tech leader energy. Mood: TecHub. Composition (1:1): Hero portrait framing, direct eye contact, luminous rim lighting, subtle circuit motifs. Output aspect ratio: 1:1.",
    "16x9": "Supporting artwork: Focus on abstract, illustrative, or symbolic visuals inspired by the avatar and profile context, not a literal recreation. Source avatar inspiration: A man with a bald head and a full, reddish-brown beard is presented from the chest up, wearing professional business attire. He is smiling warmly at the viewer against a dark blue background featuring an abstract glowing network pattern, suggesting a tech-oriented or connected theme. The overall presentation conveys a sense of professionalism combined with an approachable and friendly demeanor. Key visual traits: facial features: Bald head, full reddish-brown beard, dark eyebrows, and visible ears.; expression: A warm, open-mouthed smile with visible white teeth.; attire: Black suit jacket, white collared shirt, and a light blue tie with subtle horizontal stripes.; palette: Dominant dark blue, black, white, light blue, and warm skin tones with a reddish-brown beard.; background: Dark blue background featuring a glowing, interconnected network or constellation pattern with bright nodes.; mood: Professional and approachable. Profile traits (no text/logos): languages: Ruby, Shell, Python; repos: linux-for-pirates, loftwahs-cheatsheet; orgs: caremonkey, EddieHubCommunity. Constraints: no text or logos; keep safe edges for cropping and preserve clear negative space for UI overlays. If this is a 16:9 OG image, an optional small subject cameo is allowed only when the avatar clearly depicts a human; keep the figure subtle, off-center, and non-dominant. Otherwise depict no person and lean fully abstract. Visual style: neon-lit anime portrait with confident tech leader energy. Mood: TecHub. Composition (16:9): Layout-aware OG composition with strong negative space for overlays; visual motifs from profile data (languages as color ribbons, repos as constellations, activity as arcs). Optional small subject cameo only if avatar clearly depicts a human; keep off-center, low-contrast. No text or logos. Output aspect ratio: 16:9.",
    "3x1": "Supporting artwork: Focus on abstract, illustrative, or symbolic visuals inspired by the avatar and profile context, not a literal recreation. Source avatar inspiration: A man with a bald head and a full, reddish-brown beard is presented from the chest up, wearing professional business attire. He is smiling warmly at the viewer against a dark blue background featuring an abstract glowing network pattern, suggesting a tech-oriented or connected theme. The overall presentation conveys a sense of professionalism combined with an approachable and friendly demeanor. Key visual traits: facial features: Bald head, full reddish-brown beard, dark eyebrows, and visible ears.; expression: A warm, open-mouthed smile with visible white teeth.; attire: Black suit jacket, white collared shirt, and a light blue tie with subtle horizontal stripes.; palette: Dominant dark blue, black, white, light blue, and warm skin tones with a reddish-brown beard.; background: Dark blue background featuring a glowing, interconnected network or constellation pattern with bright nodes.; mood: Professional and approachable. Profile traits (no text/logos): languages: Ruby, Shell, Python; repos: linux-for-pirates, loftwahs-cheatsheet; orgs: caremonkey, EddieHubCommunity. Constraints: no text or logos; keep safe edges for cropping and preserve clear negative space for UI overlays. If this is a 16:9 OG image, an optional small subject cameo is allowed only when the avatar clearly depicts a human; keep the figure subtle, off-center, and non-dominant. Otherwise depict no person and lean fully abstract. Visual style: neon-lit anime portrait with confident tech leader energy. Mood: TecHub. Composition (3:1): Ultra-wide banner with high-contrast yet unobtrusive abstract motifs; prioritize safe edges and central negative space for card UI. Use profile-inspired symbolism (language strands, repository nodes, subtle activity trails). Absolutely no person depiction, no text, no logos. Output aspect ratio: 3:1.",
    "9x16": "Supporting artwork: Focus on abstract, illustrative, or symbolic visuals inspired by the avatar and profile context, not a literal recreation. Source avatar inspiration: A man with a bald head and a full, reddish-brown beard is presented from the chest up, wearing professional business attire. He is smiling warmly at the viewer against a dark blue background featuring an abstract glowing network pattern, suggesting a tech-oriented or connected theme. The overall presentation conveys a sense of professionalism combined with an approachable and friendly demeanor. Key visual traits: facial features: Bald head, full reddish-brown beard, dark eyebrows, and visible ears.; expression: A warm, open-mouthed smile with visible white teeth.; attire: Black suit jacket, white collared shirt, and a light blue tie with subtle horizontal stripes.; palette: Dominant dark blue, black, white, light blue, and warm skin tones with a reddish-brown beard.; background: Dark blue background featuring a glowing, interconnected network or constellation pattern with bright nodes.; mood: Professional and approachable. Profile traits (no text/logos): languages: Ruby, Shell, Python; repos: linux-for-pirates, loftwahs-cheatsheet; orgs: caremonkey, EddieHubCommunity. Constraints: no text or logos; keep safe edges for cropping and preserve clear negative space for UI overlays. If this is a 16:9 OG image, an optional small subject cameo is allowed only when the avatar clearly depicts a human; keep the figure subtle, off-center, and non-dominant. Otherwise depict no person and lean fully abstract. Visual style: neon-lit anime portrait with confident tech leader energy. Mood: TecHub. Composition (9:16): Vertical supporting art with layered gradients and subtle geometric meshes; carry profile-inspired motifs tastefully. No text or logos; avoid literal portrait. Output aspect ratio: 9:16."
  }
}
