{
  "avatar_description": "The avatar features a bald man with a prominent reddish-brown beard, presenting a professional and approachable demeanor. He is formally dressed in a dark suit, a crisp white shirt, and a bright blue tie, suggesting a business or corporate context. The background displays a dark blue digital network pattern with glowing nodes, indicating a technological or interconnected theme for the overall vibe.",
  "structured_description": {
    "description": "The avatar features a bald man with a prominent reddish-brown beard, presenting a professional and approachable demeanor. He is formally dressed in a dark suit, a crisp white shirt, and a bright blue tie, suggesting a business or corporate context. The background displays a dark blue digital network pattern with glowing nodes, indicating a technological or interconnected theme for the overall vibe.",
    "facial_features": "The avatar has a bald head and a full, well-groomed reddish-brown beard that covers his chin and cheeks. His eyebrows are dark and full, complementing his beard.",
    "expression": "The man displays a pleasant and confident expression, characterized by a slight, friendly smile with visible teeth and direct eye contact.",
    "attire": "He is wearing a classic black suit jacket over a clean white collared shirt. A vibrant light blue tie with subtle horizontal stripes completes his formal attire.",
    "palette": "The dominant colors are dark blue from the background, black from the suit, white from the shirt, and the warm reddish-brown of the beard. The light blue tie and glowing network nodes provide bright accents against the darker tones.",
    "background": "The background is a deep blue with an abstract digital network pattern, featuring interconnected glowing light blue nodes and lines. The pattern is slightly out of focus, creating depth.",
    "mood": "Professional and technologically engaged."
  },
  "prompts": {
    "1x1": "Portrait prompt: primary hero shot. Subject description: The avatar features a bald man with a prominent reddish-brown beard, presenting a professional and approachable demeanor. He is formally dressed in a dark suit, a crisp white shirt, and a bright blue tie, suggesting a business or corporate context. The background displays a dark blue digital network pattern with glowing nodes, indicating a technological or interconnected theme for the overall vibe. Key visual traits: facial features: The avatar has a bald head and a full, well-groomed reddish-brown beard that covers his chin and cheeks. His eyebrows are dark and full, complementing his beard.; expression: The man displays a pleasant and confident expression, characterized by a slight, friendly smile with visible teeth and direct eye contact.; attire: He is wearing a classic black suit jacket over a clean white collared shirt. A vibrant light blue tie with subtle horizontal stripes completes his formal attire.; palette: The dominant colors are dark blue from the background, black from the suit, white from the shirt, and the warm reddish-brown of the beard. The light blue tie and glowing network nodes provide bright accents against the darker tones.; background: The background is a deep blue with an abstract digital network pattern, featuring interconnected glowing light blue nodes and lines. The pattern is slightly out of focus, creating depth.; mood: Professional and technologically engaged.. Profile traits (no text/logos): languages: Ruby, Shell, Python; repos: linux-for-pirates, loftwahs-cheatsheet; orgs: caremonkey, EddieHubCommunity; foll. Visual guidance: Use the avatar as inspiration only; do not copy it verbatim. If the avatar is not a human photo, avoid rendering a realistic human faceâ€”use emblematic or stylized representation instead. Visual style: neon-lit anime portrait with confident tech leader energy. Mood: TecHub. Composition (1:1): Hero portrait framing, direct eye contact, luminous rim lighting, subtle circuit motifs. Output aspect ratio: 1:1.",
    "16x9": "Supporting artwork: Focus on abstract, illustrative, or symbolic visuals inspired by the avatar and profile context, not a literal recreation. Source avatar inspiration: The avatar features a bald man with a prominent reddish-brown beard, presenting a professional and approachable demeanor. He is formally dressed in a dark suit, a crisp white shirt, and a bright blue tie, suggesting a business or corporate context. The background displays a dark blue digital network pattern with glowing nodes, indicating a technological or interconnected theme for the overall vibe. Key visual traits: facial features: The avatar has a bald head and a full, well-groomed reddish-brown beard that covers his chin and cheeks. His eyebrows are dark and full, complementing his beard.; expression: The man displays a pleasant and confident expression, characterized by a slight, friendly smile with visible teeth and direct eye contact.; attire: He is wearing a classic black suit jacket over a clean white collared shirt. A vibrant light blue tie with subtle horizontal stripes completes his formal attire.; palette: The dominant colors are dark blue from the background, black from the suit, white from the shirt, and the warm reddish-brown of the beard. The light blue tie and glowing network nodes provide bright accents against the darker tones.; background: The background is a deep blue with an abstract digital network pattern, featuring interconnected glowing light blue nodes and lines. The pattern is slightly out of focus, creating depth.; mood: Professional and technologically engaged.. Profile traits (no text/logos): languages: Ruby, Shell, Python; repos: linux-for-pirates, loftwahs-cheatsheet; orgs: caremonkey, EddieHubCommunity; foll. Constraints: no text or logos; keep safe edges for cropping and preserve clear negative space for UI overlays. If this is a 16:9 OG image, an optional small subject cameo is allowed only when the avatar clearly depicts a human; keep the figure subtle, off-center, and non-dominant. Otherwise depict no person and lean fully abstract. Visual style: neon-lit anime portrait with confident tech leader energy. Mood: TecHub. Composition (16:9): Layout-aware OG composition with strong negative space for overlays; visual motifs from profile data (languages as color ribbons, repos as constellations, activity as arcs). Optional small subject cameo only if avatar clearly depicts a human; keep off-center, low-contrast. No text or logos. Output aspect ratio: 16:9.",
    "3x1": "Supporting artwork: Focus on abstract, illustrative, or symbolic visuals inspired by the avatar and profile context, not a literal recreation. Source avatar inspiration: The avatar features a bald man with a prominent reddish-brown beard, presenting a professional and approachable demeanor. He is formally dressed in a dark suit, a crisp white shirt, and a bright blue tie, suggesting a business or corporate context. The background displays a dark blue digital network pattern with glowing nodes, indicating a technological or interconnected theme for the overall vibe. Key visual traits: facial features: The avatar has a bald head and a full, well-groomed reddish-brown beard that covers his chin and cheeks. His eyebrows are dark and full, complementing his beard.; expression: The man displays a pleasant and confident expression, characterized by a slight, friendly smile with visible teeth and direct eye contact.; attire: He is wearing a classic black suit jacket over a clean white collared shirt. A vibrant light blue tie with subtle horizontal stripes completes his formal attire.; palette: The dominant colors are dark blue from the background, black from the suit, white from the shirt, and the warm reddish-brown of the beard. The light blue tie and glowing network nodes provide bright accents against the darker tones.; background: The background is a deep blue with an abstract digital network pattern, featuring interconnected glowing light blue nodes and lines. The pattern is slightly out of focus, creating depth.; mood: Professional and technologically engaged.. Profile traits (no text/logos): languages: Ruby, Shell, Python; repos: linux-for-pirates, loftwahs-cheatsheet; orgs: caremonkey, EddieHubCommunity; foll. Constraints: no text or logos; keep safe edges for cropping and preserve clear negative space for UI overlays. If this is a 16:9 OG image, an optional small subject cameo is allowed only when the avatar clearly depicts a human; keep the figure subtle, off-center, and non-dominant. Otherwise depict no person and lean fully abstract. Visual style: neon-lit anime portrait with confident tech leader energy. Mood: TecHub. Composition (3:1): Ultra-wide banner with high-contrast yet unobtrusive abstract motifs; prioritize safe edges and central negative space for card UI. Use profile-inspired symbolism (language strands, repository nodes, subtle activity trails). Absolutely no person depiction, no text, no logos. Output aspect ratio: 3:1.",
    "9x16": "Supporting artwork: Focus on abstract, illustrative, or symbolic visuals inspired by the avatar and profile context, not a literal recreation. Source avatar inspiration: The avatar features a bald man with a prominent reddish-brown beard, presenting a professional and approachable demeanor. He is formally dressed in a dark suit, a crisp white shirt, and a bright blue tie, suggesting a business or corporate context. The background displays a dark blue digital network pattern with glowing nodes, indicating a technological or interconnected theme for the overall vibe. Key visual traits: facial features: The avatar has a bald head and a full, well-groomed reddish-brown beard that covers his chin and cheeks. His eyebrows are dark and full, complementing his beard.; expression: The man displays a pleasant and confident expression, characterized by a slight, friendly smile with visible teeth and direct eye contact.; attire: He is wearing a classic black suit jacket over a clean white collared shirt. A vibrant light blue tie with subtle horizontal stripes completes his formal attire.; palette: The dominant colors are dark blue from the background, black from the suit, white from the shirt, and the warm reddish-brown of the beard. The light blue tie and glowing network nodes provide bright accents against the darker tones.; background: The background is a deep blue with an abstract digital network pattern, featuring interconnected glowing light blue nodes and lines. The pattern is slightly out of focus, creating depth.; mood: Professional and technologically engaged.. Profile traits (no text/logos): languages: Ruby, Shell, Python; repos: linux-for-pirates, loftwahs-cheatsheet; orgs: caremonkey, EddieHubCommunity; foll. Constraints: no text or logos; keep safe edges for cropping and preserve clear negative space for UI overlays. If this is a 16:9 OG image, an optional small subject cameo is allowed only when the avatar clearly depicts a human; keep the figure subtle, off-center, and non-dominant. Otherwise depict no person and lean fully abstract. Visual style: neon-lit anime portrait with confident tech leader energy. Mood: TecHub. Composition (9:16): Vertical supporting art with layered gradients and subtle geometric meshes; carry profile-inspired motifs tastefully. No text or logos; avoid literal portrait. Output aspect ratio: 9:16."
  }
}
